{
  "attempts": [
    {
      "number": 1,
      "status": "fail",
      "startedAt": "2025-10-11T23:41:23.285Z",
      "finishedAt": "2025-10-11T23:41:23.285Z",
      "changedFiles": [
        "src/index.ts"
      ],
      "summary": "Attempt 1 failed",
      "testResult": {
        "status": "fail",
        "passCount": 1,
        "failCount": 1,
        "durationMs": 1100,
        "logsPath": "logs/attempt1.log"
      },
      "durationMs": 1100,
      "cumulativeTime": 1100
    },
    {
      "number": 2,
      "status": "pass",
      "startedAt": "2025-10-11T23:41:23.285Z",
      "finishedAt": "2025-10-11T23:41:23.285Z",
      "changedFiles": [
        "src/index.ts"
      ],
      "summary": "Attempt 2 passed",
      "testResult": {
        "status": "pass",
        "passCount": 2,
        "failCount": 0,
        "durationMs": 900,
        "logsPath": "logs/repair.log"
      },
      "durationMs": 900,
      "cumulativeTime": 2000
    }
  ],
  "finalStatus": "pass",
  "totalAttempts": 2,
  "successAttemptNumber": 2
}