{
  "attempts": [
    {
      "number": 1,
      "status": "fail",
      "startedAt": "2025-10-11T23:31:05.424Z",
      "finishedAt": "2025-10-11T23:31:05.424Z",
      "changedFiles": [
        "src/index.ts"
      ],
      "summary": "First attempt failed",
      "testResult": {
        "status": "fail",
        "passCount": 1,
        "failCount": 1,
        "durationMs": 800,
        "logsPath": "logs/attempt1.log"
      },
      "durationMs": 800,
      "cumulativeTime": 800
    },
    {
      "number": 2,
      "status": "fail",
      "startedAt": "2025-10-11T23:31:05.424Z",
      "finishedAt": "2025-10-11T23:31:05.424Z",
      "changedFiles": [
        "src/index.ts"
      ],
      "summary": "Second attempt failed",
      "testResult": {
        "status": "fail",
        "passCount": 1,
        "failCount": 1,
        "durationMs": 900,
        "logsPath": "logs/attempt2.log"
      },
      "durationMs": 900,
      "cumulativeTime": 1700
    },
    {
      "number": 3,
      "status": "pass",
      "startedAt": "2025-10-11T23:31:05.424Z",
      "finishedAt": "2025-10-11T23:31:05.424Z",
      "changedFiles": [
        "src/index.ts"
      ],
      "summary": "Final attempt succeeded",
      "testResult": {
        "status": "pass",
        "passCount": 2,
        "failCount": 0,
        "durationMs": 950,
        "logsPath": "logs/attempt3.log"
      },
      "durationMs": 950,
      "cumulativeTime": 2650
    }
  ],
  "finalStatus": "pass",
  "totalAttempts": 3,
  "successAttemptNumber": 3
}